{
  "$schema": "https://json-schema.org/draft/2020-12/schema",
  "$id": "https://raw.githubusercontent.com/lukqo/Yomuhon-Sources/main/schemas/source-schema-v1.json",
  "title": "Yomuhon Declarative Source Config V1",
  "type": "object",
  "required": [
    "schemaVersion",
    "id",
    "name",
    "version",
    "language",
    "baseURL",
    "engineMode",
    "enabledByDefault",
    "experimental",
    "allowedDomains",
    "supports",
    "routes",
    "selectors"
  ],
  "properties": {
    "schemaVersion": {
      "type": "integer",
      "const": 1
    },
    "id": {
      "type": "string",
      "pattern": "^[a-z0-9][a-z0-9_-]*$"
    },
    "name": {
      "type": "string",
      "minLength": 1
    },
    "version": {
      "type": "integer",
      "minimum": 1
    },
    "language": {
      "type": "string",
      "minLength": 2
    },
    "baseURL": {
      "type": "string",
      "format": "uri",
      "pattern": "^https://"
    },
    "engineMode": {
      "enum": [
        "html",
        "json-api"
      ]
    },
    "enabledByDefault": {
      "type": "boolean",
      "const": false
    },
    "experimental": {
      "type": "boolean"
    },
    "allowedDomains": {
      "type": "array",
      "minItems": 1,
      "uniqueItems": true,
      "items": {
        "type": "string",
        "pattern": "^[A-Za-z0-9.-]+$"
      }
    },
    "supports": {
      "type": "object",
      "required": [
        "search",
        "popular",
        "details",
        "chapters",
        "pages"
      ],
      "properties": {
        "search": {
          "type": "boolean"
        },
        "popular": {
          "type": "boolean"
        },
        "details": {
          "type": "boolean"
        },
        "chapters": {
          "type": "boolean"
        },
        "pages": {
          "type": "boolean"
        },
        "genres": {
          "type": "boolean"
        },
        "types": {
          "type": "boolean"
        }
      },
      "additionalProperties": false
    },
    "network": {
      "type": "object",
      "properties": {
        "headers": {
          "type": "object",
          "additionalProperties": {
            "type": "string"
          }
        }
      },
      "additionalProperties": false
    },
    "routes": {
      "type": "object",
      "properties": {
        "popular": {
          "$ref": "#/$defs/route"
        },
        "search": {
          "$ref": "#/$defs/route"
        }
      },
      "additionalProperties": false
    },
    "selectors": {
      "type": "object",
      "properties": {
        "popular": {
          "$ref": "#/$defs/listSelector"
        },
        "search": {
          "$ref": "#/$defs/listSelector"
        },
        "details": {
          "$ref": "#/$defs/detailSelector"
        },
        "chapters": {
          "$ref": "#/$defs/chapterSelector"
        },
        "pages": {
          "$ref": "#/$defs/pagesSelector"
        }
      },
      "additionalProperties": false
    },
    "api": {
      "$ref": "#/$defs/apiConfig"
    },
    "discover": {
      "$ref": "#/$defs/discoverConfig"
    },
    "cleanup": {
      "type": "object",
      "properties": {
        "decodeHTMLEntities": {
          "type": "boolean"
        },
        "normalizeWhitespace": {
          "type": "boolean"
        },
        "removeText": {
          "type": "array",
          "items": {
            "type": "string"
          }
        }
      },
      "additionalProperties": false
    },
    "tests": {
      "type": "object",
      "required": [
        "query",
        "minSearchResults",
        "minChapters",
        "minPages"
      ],
      "properties": {
        "query": {
          "type": "string",
          "minLength": 1
        },
        "minSearchResults": {
          "type": "integer",
          "minimum": 1
        },
        "minChapters": {
          "type": "integer",
          "minimum": 1
        },
        "minPages": {
          "type": "integer",
          "minimum": 1
        }
      },
      "additionalProperties": false
    },
    "operationModes": {
      "$ref": "#/$defs/operationModes"
    },
    "identity": {
      "$ref": "#/$defs/identityConfig"
    }
  },
  "$defs": {
    "route": {
      "type": "object",
      "required": [
        "path"
      ],
      "properties": {
        "path": {
          "type": "string",
          "pattern": "^/"
        },
        "query": {
          "type": "object",
          "additionalProperties": {
            "type": "string"
          }
        },
        "pagination": {
          "type": "object",
          "required": [
            "type"
          ],
          "properties": {
            "type": {
              "enum": [
                "path",
                "query"
              ]
            },
            "param": {
              "type": "string"
            },
            "start": {
              "type": "integer",
              "minimum": 0
            },
            "maxPages": {
              "type": "integer",
              "minimum": 1,
              "maximum": 5
            }
          },
          "additionalProperties": false
        }
      },
      "additionalProperties": false
    },
    "fieldSelector": {
      "type": "object",
      "properties": {
        "selectors": {
          "type": "array",
          "minItems": 1,
          "items": {
            "type": "string",
            "minLength": 1
          }
        },
        "selector": {
          "type": "string",
          "minLength": 1
        },
        "attrs": {
          "type": "array",
          "minItems": 1,
          "items": {
            "type": "string",
            "minLength": 1
          }
        },
        "attr": {
          "type": "string",
          "minLength": 1
        },
        "regex": {
          "type": "string",
          "minLength": 1
        },
        "required": {
          "type": "boolean"
        },
        "cleanup": {
          "type": "array",
          "items": {
            "enum": [
              "stripHTML",
              "decodeEntities",
              "normalizeWhitespace",
              "trim"
            ]
          }
        }
      },
      "additionalProperties": false
    },
    "listSelector": {
      "type": "object",
      "required": [
        "container",
        "title",
        "url"
      ],
      "properties": {
        "container": {
          "type": "string",
          "minLength": 1
        },
        "title": {
          "$ref": "#/$defs/fieldSelector"
        },
        "url": {
          "$ref": "#/$defs/fieldSelector"
        },
        "cover": {
          "$ref": "#/$defs/fieldSelector"
        },
        "htmlScope": {
          "$ref": "#/$defs/htmlScope"
        },
        "alternativeTitles": {
          "$ref": "#/$defs/fieldSelector"
        },
        "author": {
          "$ref": "#/$defs/fieldSelector"
        },
        "year": {
          "$ref": "#/$defs/fieldSelector"
        }
      },
      "additionalProperties": false
    },
    "detailSelector": {
      "type": "object",
      "properties": {
        "title": {
          "$ref": "#/$defs/fieldSelector"
        },
        "synopsis": {
          "$ref": "#/$defs/fieldSelector"
        },
        "cover": {
          "$ref": "#/$defs/fieldSelector"
        },
        "alternativeTitles": {
          "$ref": "#/$defs/fieldSelector"
        },
        "author": {
          "$ref": "#/$defs/fieldSelector"
        },
        "year": {
          "$ref": "#/$defs/fieldSelector"
        }
      },
      "additionalProperties": false
    },
    "chapterSelector": {
      "type": "object",
      "required": [
        "container",
        "url"
      ],
      "properties": {
        "container": {
          "type": "string",
          "minLength": 1
        },
        "title": {
          "$ref": "#/$defs/fieldSelector"
        },
        "url": {
          "$ref": "#/$defs/fieldSelector"
        },
        "number": {
          "type": "object",
          "required": [
            "from",
            "regex"
          ],
          "properties": {
            "from": {
              "enum": [
                "text",
                "url"
              ]
            },
            "regex": {
              "type": "string",
              "minLength": 1
            }
          },
          "additionalProperties": false
        },
        "sort": {
          "enum": [
            "numberAscending",
            "numberDescending"
          ]
        },
        "dedupeByNumber": {
          "type": "boolean"
        }
      },
      "additionalProperties": false
    },
    "pagesSelector": {
      "type": "object",
      "required": [
        "extractors"
      ],
      "properties": {
        "extractors": {
          "type": "array",
          "minItems": 1,
          "items": {
            "type": "object",
            "required": [
              "type"
            ],
            "properties": {
              "type": {
                "enum": [
                  "css",
                  "regex"
                ]
              },
              "selector": {
                "type": "string"
              },
              "attrs": {
                "type": "array",
                "items": {
                  "type": "string"
                }
              },
              "pattern": {
                "type": "string"
              }
            },
            "additionalProperties": false
          }
        },
        "filters": {
          "type": "object",
          "properties": {
            "mustContain": {
              "type": "array",
              "items": {
                "type": "string"
              }
            },
            "blockContains": {
              "type": "array",
              "items": {
                "type": "string"
              }
            }
          },
          "additionalProperties": false
        }
      },
      "additionalProperties": false
    },
    "apiValue": {
      "oneOf": [
        {
          "type": "string"
        },
        {
          "type": "integer"
        },
        {
          "type": "boolean"
        },
        {
          "type": "array",
          "items": {
            "type": "string"
          }
        }
      ]
    },
    "apiRequest": {
      "type": "object",
      "required": [
        "method",
        "path"
      ],
      "properties": {
        "method": {
          "const": "GET"
        },
        "path": {
          "type": "string",
          "pattern": "^/"
        },
        "query": {
          "type": "object",
          "additionalProperties": {
            "$ref": "#/$defs/apiValue"
          }
        },
        "baseURL": {
          "type": "string",
          "format": "uri",
          "pattern": "^https://"
        }
      },
      "additionalProperties": false
    },
    "apiPagination": {
      "type": "object",
      "required": [
        "offsetParam",
        "limitParam",
        "limit"
      ],
      "properties": {
        "offsetParam": {
          "type": "string",
          "minLength": 1
        },
        "limitParam": {
          "type": "string",
          "minLength": 1
        },
        "limit": {
          "type": "integer",
          "minimum": 1,
          "maximum": 500
        },
        "maxPages": {
          "type": "integer",
          "minimum": 1,
          "maximum": 1000
        },
        "maxItems": {
          "type": "integer",
          "minimum": 1,
          "maximum": 100000
        },
        "totalPath": {
          "type": "string",
          "minLength": 1
        }
      },
      "additionalProperties": false
    },
    "apiSearch": {
      "type": "object",
      "required": [
        "request",
        "itemsPath",
        "idPath",
        "titlePaths"
      ],
      "properties": {
        "request": {
          "$ref": "#/$defs/apiRequest"
        },
        "itemsPath": {
          "type": "string",
          "minLength": 1
        },
        "idPath": {
          "type": "string",
          "minLength": 1
        },
        "titlePaths": {
          "type": "array",
          "minItems": 1,
          "items": {
            "type": "string",
            "minLength": 1
          }
        },
        "synopsisPaths": {
          "type": "array",
          "items": {
            "type": "string",
            "minLength": 1
          }
        },
        "coverRelationshipType": {
          "type": "string"
        },
        "coverFilePath": {
          "type": "string"
        },
        "coverTemplate": {
          "type": "string"
        },
        "alternativeTitlePaths": {
          "type": "array",
          "items": {
            "type": "string",
            "minLength": 1
          }
        },
        "authorPaths": {
          "type": "array",
          "items": {
            "type": "string",
            "minLength": 1
          }
        },
        "yearPath": {
          "type": "string",
          "minLength": 1
        }
      },
      "additionalProperties": false
    },
    "apiChapters": {
      "type": "object",
      "required": [
        "request",
        "itemsPath",
        "idPath",
        "numberPath"
      ],
      "properties": {
        "request": {
          "$ref": "#/$defs/apiRequest"
        },
        "pagination": {
          "$ref": "#/$defs/apiPagination"
        },
        "itemsPath": {
          "type": "string",
          "minLength": 1
        },
        "idPath": {
          "type": "string",
          "minLength": 1
        },
        "numberPath": {
          "type": "string",
          "minLength": 1
        },
        "titlePath": {
          "type": "string"
        },
        "languagePath": {
          "type": "string"
        },
        "sort": {
          "enum": [
            "numberAscending",
            "numberDescending"
          ]
        },
        "urlPath": {
          "type": "string",
          "minLength": 1
        },
        "variables": {
          "type": "object",
          "additionalProperties": {
            "$ref": "#/$defs/apiVariableRule"
          }
        }
      },
      "additionalProperties": false
    },
    "apiPages": {
      "type": "object",
      "required": [
        "request",
        "baseURLPath",
        "hashPath",
        "itemsPath",
        "urlTemplate"
      ],
      "properties": {
        "request": {
          "$ref": "#/$defs/apiRequest"
        },
        "baseURLPath": {
          "type": "string",
          "minLength": 1
        },
        "hashPath": {
          "type": "string",
          "minLength": 1
        },
        "itemsPath": {
          "type": "string",
          "minLength": 1
        },
        "urlTemplate": {
          "type": "string",
          "minLength": 1
        }
      },
      "additionalProperties": false
    },
    "apiConfig": {
      "type": "object",
      "properties": {
        "search": {
          "$ref": "#/$defs/apiSearch"
        },
        "chapters": {
          "$ref": "#/$defs/apiChapters"
        },
        "pages": {
          "$ref": "#/$defs/apiPages"
        }
      },
      "additionalProperties": false
    },
    "discoverOperation": {
      "type": "object",
      "properties": {
        "route": {
          "$ref": "#/$defs/route"
        },
        "selector": {
          "$ref": "#/$defs/listSelector"
        },
        "api": {
          "$ref": "#/$defs/apiSearch"
        }
      },
      "additionalProperties": false
    },
    "genreItem": {
      "type": "object",
      "required": [
        "id",
        "title",
        "value"
      ],
      "properties": {
        "id": {
          "type": "string",
          "minLength": 1,
          "pattern": "^[a-z0-9][a-z0-9-]*$"
        },
        "title": {
          "type": "string",
          "minLength": 1
        },
        "value": {
          "type": "string",
          "minLength": 1
        }
      },
      "additionalProperties": false
    },
    "genreDiscovery": {
      "type": "object",
      "required": [
        "items",
        "operation"
      ],
      "properties": {
        "items": {
          "type": "array",
          "minItems": 1,
          "items": {
            "$ref": "#/$defs/genreItem"
          }
        },
        "operation": {
          "$ref": "#/$defs/discoverOperation"
        }
      },
      "additionalProperties": false
    },
    "typeItem": {
      "type": "object",
      "required": [
        "id",
        "title",
        "value"
      ],
      "properties": {
        "id": {
          "type": "string",
          "minLength": 1,
          "pattern": "^[a-z0-9][a-z0-9-]*$"
        },
        "title": {
          "type": "string",
          "minLength": 1
        },
        "value": {
          "type": "string",
          "minLength": 1
        }
      },
      "additionalProperties": false
    },
    "typeDiscovery": {
      "type": "object",
      "required": [
        "items",
        "operation"
      ],
      "properties": {
        "items": {
          "type": "array",
          "minItems": 1,
          "items": {
            "$ref": "#/$defs/typeItem"
          }
        },
        "operation": {
          "$ref": "#/$defs/discoverOperation"
        }
      },
      "additionalProperties": false
    },
    "discoverConfig": {
      "type": "object",
      "properties": {
        "popular": {
          "$ref": "#/$defs/discoverOperation"
        },
        "genres": {
          "$ref": "#/$defs/genreDiscovery"
        },
        "types": {
          "$ref": "#/$defs/typeDiscovery"
        }
      },
      "additionalProperties": false
    },
    "htmlScope": {
      "type": "object",
      "properties": {
        "afterRegex": {
          "type": "string",
          "minLength": 1
        },
        "beforeRegex": {
          "type": "string",
          "minLength": 1
        }
      },
      "anyOf": [
        {
          "required": [
            "afterRegex"
          ]
        },
        {
          "required": [
            "beforeRegex"
          ]
        }
      ],
      "additionalProperties": false
    },
    "operationModes": {
      "type": "object",
      "properties": {
        "popular": {
          "enum": [
            "html",
            "json-api"
          ]
        },
        "search": {
          "enum": [
            "html",
            "json-api"
          ]
        },
        "details": {
          "enum": [
            "html",
            "json-api"
          ]
        },
        "chapters": {
          "enum": [
            "html",
            "json-api"
          ]
        },
        "pages": {
          "enum": [
            "html",
            "json-api"
          ]
        },
        "genres": {
          "enum": [
            "html",
            "json-api"
          ]
        },
        "types": {
          "enum": [
            "html",
            "json-api"
          ]
        }
      },
      "additionalProperties": false
    },
    "identityConfig": {
      "type": "object",
      "properties": {
        "preserveQueryItems": {
          "type": "array",
          "uniqueItems": true,
          "items": {
            "type": "string",
            "minLength": 1,
            "pattern": "^[A-Za-z0-9_.~-]+$"
          }
        }
      },
      "additionalProperties": false
    },
    "apiVariableRule": {
      "type": "object",
      "required": [
        "from"
      ],
      "properties": {
        "from": {
          "enum": [
            "mangaID",
            "mangaURL"
          ]
        },
        "regex": {
          "type": "string",
          "minLength": 1
        },
        "default": {
          "type": "string",
          "minLength": 1
        }
      },
      "additionalProperties": false
    }
  },
  "additionalProperties": false
}
