{
  "schemaVersion": 1,
  "id": "webtoon_en",
  "name": "WEBTOON English",
  "version": 1,
  "language": "en",
  "baseURL": "https://www.webtoons.com",
  "engineMode": "html",
  "operationModes": {
    "chapters": "json-api"
  },
  "identity": {
    "preserveQueryItems": [
      "title_no",
      "titleNo"
    ]
  },
  "enabledByDefault": false,
  "experimental": true,
  "allowedDomains": [
    "webtoons.com",
    "www.webtoons.com",
    "m.webtoons.com",
    "webtoon-phinf.pstatic.net",
    "swebtoon-phinf.pstatic.net"
  ],
  "supports": {
    "search": true,
    "popular": true,
    "details": true,
    "chapters": true,
    "pages": true,
    "genres": false
  },
  "network": {
    "headers": {
      "Referer": "https://www.webtoons.com/",
      "Accept-Language": "en-US,en;q=0.9",
      "User-Agent": "Mozilla/5.0 (Macintosh; Intel Mac OS X 10_15_7) AppleWebKit/537.36 Yomuhon/1.0"
    }
  },
  "routes": {
    "popular": {
      "path": "/en/ranking/trending"
    },
    "search": {
      "path": "/en/search",
      "query": {
        "keyword": "{{query}}"
      }
    }
  },
  "selectors": {
    "popular": {
      "container": ".webtoon_list li a",
      "title": {
        "selectors": [
          ".title"
        ],
        "attrs": [
          "text"
        ],
        "required": true
      },
      "url": {
        "attrs": [
          "href"
        ],
        "required": true
      },
      "cover": {
        "selectors": [
          "img"
        ],
        "attrs": [
          "src",
          "data-src"
        ]
      }
    },
    "search": {
      "container": ".webtoon_list li a",
      "title": {
        "selectors": [
          ".title"
        ],
        "attrs": [
          "text"
        ],
        "required": true
      },
      "url": {
        "attrs": [
          "href"
        ],
        "required": true
      },
      "cover": {
        "selectors": [
          "img"
        ],
        "attrs": [
          "src",
          "data-src"
        ]
      }
    },
    "details": {
      "title": {
        "selectors": [
          "h1.subj",
          "h3.subj"
        ],
        "attrs": [
          "text"
        ],
        "required": true
      },
      "synopsis": {
        "selectors": [
          "#_asideDetail p.summary"
        ],
        "attrs": [
          "text"
        ]
      },
      "cover": {
        "selectors": [
          "head meta[property='og:image']",
          ".detail_header .thmb img"
        ],
        "attrs": [
          "content",
          "src"
        ]
      },
      "author": {
        "selectors": [
          ".detail_header .info .author_area",
          ".detail_header .info .author"
        ],
        "attrs": [
          "text"
        ]
      }
    },
    "chapters": {
      "container": "#_listUl li a",
      "title": {
        "selectors": [
          ".subj"
        ],
        "attrs": [
          "text"
        ]
      },
      "url": {
        "attrs": [
          "href"
        ],
        "required": true
      },
      "number": {
        "from": "url",
        "regex": "[?&]episode_no=([0-9]+)"
      },
      "sort": "numberAscending"
    },
    "pages": {
      "extractors": [
        {
          "type": "css",
          "selector": "div#_imageList img",
          "attrs": [
            "data-url",
            "src"
          ]
        }
      ],
      "filters": {
        "blockContains": [
          "blank.gif",
          "loading.gif"
        ]
      }
    }
  },
  "api": {
    "chapters": {
      "request": {
        "method": "GET",
        "baseURL": "https://m.webtoons.com",
        "path": "/api/v1/{{contentType}}/{{titleID}}/episodes",
        "query": {
          "pageSize": 99999,
          "readingLanguageCode": "en"
        }
      },
      "itemsPath": "result.episodeList",
      "idPath": "viewerLink",
      "numberPath": "episodeNo",
      "titlePath": "episodeTitle",
      "urlPath": "viewerLink",
      "variables": {
        "titleID": {
          "from": "mangaURL",
          "regex": "[?&](?:title_no|titleNo)=([0-9]+)"
        },
        "contentType": {
          "from": "mangaURL",
          "regex": "/(canvas)/",
          "default": "webtoon"
        }
      },
      "sort": "numberAscending"
    }
  },
  "cleanup": {
    "decodeHTMLEntities": true,
    "normalizeWhitespace": true
  },
  "tests": {
    "query": "love",
    "minSearchResults": 1,
    "minChapters": 1,
    "minPages": 1
  }
}
